{
  "center": [10.0, -5.0, 3.0],
  "confidence": "validation_fixture",
  "geometry": "planar",
  "interface_width": 3.0,
  "lower_offset": -15.0,
  "metadata": {
    "base_structure": "1UBQ",
    "rotation_matrix_row_major": [[0.0, 0.0, 1.0], [0.0, 1.0, 0.0], [-1.0, 0.0, 0.0]],
    "translation": [10.0, -5.0, 3.0]
  },
  "normal": [1.0, 0.0, 0.0],
  "schema_version": "1.0",
  "source": "synthetic_rigid_transform",
  "source_version": "stage2-validation-1",
  "upper_offset": 15.0
}
